<?xml version="1.0" encoding="UTF-8"?>
<!DOCTYPE alumnos SYSTEM "PRUEBASdtd.dtd">
<alumnos>
  <alumno>
    <nombre>Miguel</nombre>
    <apellido>Triigueros</apellido>
    <curso>DAM</curso>
  </alumno>
  <alumno>
    <nombre>Juan</nombre>
    <apellido>Muñoz</apellido>
    <curso>DAW</curso>
  </alumno>
  <alumno>
    <nombre>Vicente</nombre>
    <apellido>Muñoz</apellido>
    <curso>SMR</curso>
  </alumno>
  <alumno>
    <nombre>Pedro</nombre>
    <apellido>dfad</apellido>
    <curso>&pais;</curso>
  </alumno>
</alumnos>